{"evidenceRefs":[{"path":"job/snapshot.json","sha256":"819c087bd8fc5a6fbf833ff13e31915433bc1687f32e8231bd6263718f31bab8"}],"generatedAt":"2026-02-02T00:00:00.000Z","invoiceId":"invoice_fixture_1","items":[{"code":"WORK_MINUTES","quantity":"10"}],"jobProof":{"embeddedPath":"payload/job_proof_bundle","headAttestationHash":"c70b62f9e28ac91fa07073c802495d1801921c0d01924a2538f981a7e18f8d5b","manifestHash":"6775ce8a23cb436fdd6e2809bf79d2b1ac05f76a820094342b0cc68f425ef9d8"},"schemaVersion":"MeteringReport.v1","tenantId":"tenant_fixture"}
